{
  "$schema": "../schemas/evidence-v1.schema.json",
  "schemaVersion": "evidence-v1",
  "observedAt": "2026-09-29",
  "sources": {
    "core": {
      "source": {
        "kind": "repository",
        "repository": "redact-secret/redact-secret",
        "revision": "67a7b9e47a660cea69fb377da17041b4bc5dc677",
        "release": "0.1.0-beta.11"
      },
      "observedAt": "2026-09-29",
      "freshness": "fresh"
    },
    "benchmarks": {
      "source": {
        "kind": "repository",
        "repository": "redact-secret/redact-secret-benchmarks",
        "revision": "86efbaf21a347fc6fbc7b4bf270d982ee26ae2ac"
      },
      "observedAt": "2026-09-29",
      "freshness": "fresh"
    },
    "adapters": {
      "source": {
        "kind": "registry",
        "registry": "npm",
        "package": "@redact-secret/adapter",
        "url": "https://registry.npmjs.org/@redact-secret%2fadapter",
        "version": "0.1.3",
        "revision": "f57bd4e7c8ef84de63cf9a615904f6560f4661a8",
        "repository": "redact-secret/redact-secret-adapters",
        "paths": ["README.md"]
      },
      "observedAt": "2026-09-29",
      "freshness": "fresh"
    },
    "vault": {
      "source": {
        "kind": "repository",
        "repository": "redact-secret/redact-secret-vault",
        "revision": "b2625b532bd78f0fa0ca9cdfd6a326d1c06044d0"
      },
      "observedAt": "2026-09-29",
      "freshness": "fresh"
    }
  },
  "facts": {
    "matrix": {
      "source": "core",
      "paths": ["docs/support-matrix.md"],
      "note": "check-data fails when these counts differ from the product feed's supportMatrix (data/release.json feeds.product), which the pages also use for the measured and released versions.",
      "value": {
        "families": 152,
        "providers": 76,
        "status": { "stable": 105, "unsupported": 18, "provisional": 20, "pending": 9 },
        "stableBasis": { "documented": 80, "empirical": 25 },
        "tiers": { "T1": 86, "T2": 35, "T3": 4, "T0": 2 }
      }
    },
    "taxonomy": {
      "source": "benchmarks",
      "paths": ["results/provider-dossiers-v1.json"],
      "note": "Synced by npm run sync:taxonomy from https://benchmarks.redactsecret.dev/results/provider-dossiers-v1.json (generated 2026-09-29T17:57:21.579Z at redact-secret-benchmarks 86efbaf21a347fc6fbc7b4bf270d982ee26ae2ac). The counts come from that published file, not from the revision pinned in sources.benchmarks.",
      "value": { "families": 152, "providers": 77, "withoutDetector": 25 }
    },
    "staleProse": {
      "source": "benchmarks",
      "paths": ["docs/specs/taxonomy.md"],
      "value": { "families": 79, "providers": 34, "dated": "2026-09-21" }
    },
    "baseline": {
      "source": "benchmarks",
      "paths": ["baselines/0.1.0-beta.10.json"],
      "note": "The newest frozen regression baseline at the recorded revision (baselines/ holds 0.1.0-beta.4 through 0.1.0-beta.10; none for 0.1.0-beta.11 at this revision). A name only, never its contents. Not the support-matrix pin: the product feed's supportMatrix.benchmarksRevision is a different commit, where the newest baseline is 0.1.0-beta.9.",
      "value": "0.1.0-beta.10"
    },
    "detectors": {
      "source": "core",
      "paths": ["crates/secret-scan-core/src/detectors/pattern.rs", "crates/secret-scan-core/src/types.rs"],
      "value": { "structural": 6, "alphabets": 11 }
    },
    "coreLimits": {
      "source": "core",
      "paths": ["README.md", "ARCHITECTURE.md"],
      "value": { "inputMiB": 64, "findings": 50000 }
    },
    "adapterBudgets": {
      "source": "adapters",
      "paths": ["README.md"],
      "value": { "depth": 8, "arrayLength": 1000, "objectKeys": 200, "leaves": 5000, "stringChars": 200000 }
    }
  }
}
